[
  {
    "id": "ammaiyappan-s045-d001",
    "archive_scene_id": "ammaiyappan-s045",
    "archive_scene_ordinal": 45,
    "source_scene_number": null,
    "source_heading": "தனவணிகர் வீடு",
    "speaker_label": "முத்தன்",
    "source_scene_file": "scene-045.md",
    "page_provenance": [
      {
        "pdf_page": 87,
        "printed_page": 85
      }
    ],
    "text": "பொன்னி எங்கே?"
  },
  {
    "id": "ammaiyappan-s045-d002",
    "archive_scene_id": "ammaiyappan-s045",
    "archive_scene_ordinal": 45,
    "source_scene_number": null,
    "source_heading": "தனவணிகர் வீடு",
    "speaker_label": "தனவணிகர்",
    "source_scene_file": "scene-045.md",
    "page_provenance": [
      {
        "pdf_page": 87,
        "printed_page": 85
      }
    ],
    "text": "நான் போகவில்லையென்றால் குழந்தை அவ்வளவுதான். காற்றில் மரக்கிளை முறிந்து விழுந்து..."
  },
  {
    "id": "ammaiyappan-s045-d003",
    "archive_scene_id": "ammaiyappan-s045",
    "archive_scene_ordinal": 45,
    "source_scene_number": null,
    "source_heading": "தனவணிகர் வீடு",
    "speaker_label": "முத்",
    "source_scene_file": "scene-045.md",
    "page_provenance": [
      {
        "pdf_page": 87,
        "printed_page": 85
      }
    ],
    "text": "பொன்னி எங்கே?"
  },
  {
    "id": "ammaiyappan-s045-d004",
    "archive_scene_id": "ammaiyappan-s045",
    "archive_scene_ordinal": 45,
    "source_scene_number": null,
    "source_heading": "தனவணிகர் வீடு",
    "speaker_label": "தன",
    "source_scene_file": "scene-045.md",
    "page_provenance": [
      {
        "pdf_page": 87,
        "printed_page": 85
      }
    ],
    "text": "அடடே! நான் அவசரத்தில் அவளை மறந்தே விட்டேன்!"
  },
  {
    "id": "ammaiyappan-s045-d005",
    "archive_scene_id": "ammaiyappan-s045",
    "archive_scene_ordinal": 45,
    "source_scene_number": null,
    "source_heading": "தனவணிகர் வீடு",
    "speaker_label": "முத்",
    "source_scene_file": "scene-045.md",
    "page_provenance": [
      {
        "pdf_page": 87,
        "printed_page": 85
      }
    ],
    "text": "மறந்து விட்டீர்கள்! எங்களைப் போன்ற ஏழைகள் மட்டுமல்ல; உங்கள் சீமான் இனம், இரக்க மனமும் ஒரு பண்பையே மறந்து பலநாளாயிற்று."
  }
]
