[
  {
    "id": "ammaiyappan-s057-d001",
    "archive_scene_id": "ammaiyappan-s057",
    "archive_scene_ordinal": 57,
    "source_scene_number": null,
    "source_heading": "முத்தனின் தோழர்கள் பேசிக் கொண்டிருத்தல்",
    "speaker_label": "வீரன் 1",
    "source_scene_file": "scene-057.md",
    "page_provenance": [
      {
        "pdf_page": 101,
        "printed_page": 99
      }
    ],
    "text": "தோழர்களே! எப்படியும் முத்தண்ணனை விடுவிக்க வேண்டும்."
  },
  {
    "id": "ammaiyappan-s057-d002",
    "archive_scene_id": "ammaiyappan-s057",
    "archive_scene_ordinal": 57,
    "source_scene_number": null,
    "source_heading": "முத்தனின் தோழர்கள் பேசிக் கொண்டிருத்தல்",
    "speaker_label": "வீரன் 2",
    "source_scene_file": "scene-057.md",
    "page_provenance": [
      {
        "pdf_page": 101,
        "printed_page": 99
      }
    ],
    "text": "அந்த இலட்சிய வீரனை மீட்பதற்காக நான் என் உயிரையும் தியாகம் செய்யக் காத்திருக்கிறேன்..."
  },
  {
    "id": "ammaiyappan-s057-d003",
    "archive_scene_id": "ammaiyappan-s057",
    "archive_scene_ordinal": 57,
    "source_scene_number": null,
    "source_heading": "முத்தனின் தோழர்கள் பேசிக் கொண்டிருத்தல்",
    "speaker_label": "வீரன் 1",
    "source_scene_file": "scene-057.md",
    "page_provenance": [
      {
        "pdf_page": 101,
        "printed_page": 99
      }
    ],
    "text": "தூக்குமேடையை தூள் தூளாக்கியாவது முத்தண்ணனை விடுவிப்போம்...வாருங்கள்!"
  }
]
